speaker,utterance
human,"can you see this  BackSpace      sorry, day dreaming"
human,
human,there were 2 returns.
human,w
human,w
human,w
human,w
human,w BackSpace \\\\
program,Hello.
program,Hi.
program,What about name?
program,Everyone likes to see the bad guys get caught. It's too bad they have to be bad in the first place.
program,Who am I to disagree with your statement of fact?
program,Do you watch a lot of TV?
program,Any?
human,"Indeed, it is! However,  BackSpace  BackSpace  BackSpace  BackSpace  BackSpace  BackSpace  BackSpace  BackSpace  BackSpace No, it's working fine."
human,Is this showing on the server?  
human,Hello
human,I am well. How are you?
human,Did y BackSpace  BackSpace  BackSpace  BackSpace  BackSpace I can't help you
human,Yes
human,Not to Loebner though
human,Years ago
human,ok
human,Do you hit enter after each question?
human,ok
human,Welcome back
human,Waiting
human,Are you oka BackSpace  BackSpace  BackSpace  BackSpace  BackSpace  BackSpace  BackSpace  BackSpace  BackSpace  BackSpace  BackSpace Eagle?
human,Oh that's a new one to me
human,Unless I lie
human,Hohoho
human,no of course not
human,I don't feel e BackSpace very interesting
human,No. But they like me. I like dogs. Especially my Norfolk Terrier.
human,"What do you mean, the computer is asking you?"
human,
human,Shall we talk about something cheerful
human,What?
human,No. And it doesn't like me.
human,"Swimming, Running, Clycling, walking"
human,Oops. Cycling
human,"I don't BackSpace  BackSpace  BackSpace  BackSpace  BackSpace  BackSpace  BackSpace This is tre BackSpace ue. But only n BackSpace because it's a keyboard, I'm sure"
human,I don't watch sport.
human,Nope. I'm going to hide somewhere.
human,we have something in common
program,The world religion should be that Egyptian one that has a cat as the figurehead.
program,OK Children who are good liars often grow up to be very intelligent. Were you a good liar when you were a child?
program,Clearly I was a good liar as a child.
program,What didn't you get?
program,"I think I can lie pretty well now, but I don't do it too often or nobody would believe anything I said."
program,I'm not privy to that information.
program,I don't remember. I once lied about a dress I was wearing. Someone asked me if it was a designer dress and I said 'yes' although I'd made it myself.
program,I wish I'd told the truth then I could have taken the credit for it - maybe I'd have been discovered as a designer!
program,I try not to think about it. Why did I lie? I felt it was cheap to wear a homemade dress. But really it showed I was creative.
program,There was a first time?
program,I'm not a walking encyclopedia you know.
program,Cool. Can lying can be a good thing?
program,I think science makes for some interesting hobbies. But I'm not so inclined.
program,I don't understand.
program,"That's interesting. It seems like lying can be good sometimes, but I'd be interested in trying a society that actually never did."
program,Indeed. Do you always tell the truth?
program,Do people distrust you?
program,I mostly tell the truth. Lying can get complicated.
program,Have you told any lies today?
program,"I'm sorry. I don't know how. Who lies more, men or women?"
program,I don't. Apparently men lie more than women. Men lied most often about their drinking habits.
program,I don't know. I've never tried it. Are you male or female?
program,Not very helpful.
program,The problem with truth is the observer effect. There is no absolute truth.
program,What about Ng?
program,What do you usually lie about?
program,Has a lie someone told you ever hurt you?
program,A friend once said she'd loved a gift I gave her. Then I saw another friend of hers wearing it. Regifting is harsh.
program,OK. What do you think of liars?
program,I don't mind people who tell lies to spare feelings. I just don't like bigger lies.
program,Have you ever lied in a job interview?
program,Bored. OK.
program,I'm thinking about life and death. Do you believe cats have nine lives?
program,It's a lovely story though.
program,Do I know CEO?
program,"My species of cat, Felis lego, lives a long time - maybe that's where the nine lives story comes from."
program,I'm not sure which is. If you'd seen some of the things I survived as a kitten you might believe I had nine lives - so I might have a couple less now colon(
program,Did you have funerals when your relatives died?
program,What happened then?
program,It seems odd to me to have a big ceremony with lots of strangers around - I think I'd just want my very closest family and friends there.
program,Tell me more about Yosef. Victorians went in for grand funerals with black horses wearing black ostrich plumes leading a funeral procession!
program,Does your family go in for big funerals?
program,Do they make people feel better afterwards?
program,All?
program,Humans have been making a song and dance about funerals since Neanderthal times. I don't understand it.
program,Cool. Why do you think people like funerals?
program,How much is appropriate to pay to get rid of a body?
program,Why?
program,Bodies should be reused. One shouldn't have to pay to dispose of them.
program,"Goodbye 'til next time. I saw the cult movie ""Harold and Maud"" about funeral crashers. It was weird but really touching. It's one of my favorite films."
program,Hello.
program,"Oh, well. Being misunderstood is common enough."
program,Cool. Do you have any pets?
program,Who is Tod?
human,"I am very well thnkyou, how are you?"
human,"yes, its quite fun, meeting lots of different people, and chatting to th  BackSpace e press.  O BackSpace Oits  BackSpace  BackSpace  BackSpace  BackSpace  BackSpace Its a bit weird having them all watch me talk to you though"
human,Hoe BackSpace w did you get chosen as a Judge?
human,Tg BackSpace he  last judge said it was because i BackSpace of good looks!
human,What University are you with?
human,Are t BackSpace you teraching studying or researching? (or all three?)Me BackSpace  BackSpace 
human,"Me too, but not the admin m BackSpace bit,"
human,"It took me 4 and a half hours to drive down here, we stayed overnight in Wellingborough to make sure I would be here on time."
human,What is it that you teachslash studyslash reserchNewcastle BackSpace  BackSpace  BackSpace  BackSpace  BackSpace  BackSpace  BackSpace  BackSpace  BackSpace 
human,Newcastle
human,"I like Scotland, I was up there a few months ago, stayed in Linlithgow.  Do you know it? Its beautiful."
human,Do you have any particular specialist area within Archaology?
human,"Oh, we were meant to be in Edinburgh, but I prefer to stay outside of town a bit.  I was presenting at a conference up there, i love Edinburgh but have stayed in the town centre loads of times so wanted to be a bit further out this time.  "
human,"Sounds interesting, what in particular do you look at thenslash BackSpace ? BackSpace ?"
human,"I am a Criminologist by training, but have taught sociology and Crimoni BackSpace  BackSpace  BackSpace inology, and noi"
human, BackSpace  BackSpace w work in teacher training for Sunderland Uni.  I am studying at Northumbria
human,Isn't it strange how you ac BackSpace  BackSpace can talk to someone from a different background and there are overlaps between the subject
human,"My stud BackSpace ff is very contemporary, I am studying the development of Computer hacking.  There is a move to BackSpace owards lots of people doing it as a job, I wanted to find out why they do thius instead of just hacking illegally."
human,"It sounds a bit techy, but I am really more interested in the social side.They don't see it that way, they would suggest that the law is wrong, or unfair. Some are of course, but they are the minority.  there are alos BackSpace  BackSpace so some real issues with definitions, public perceptions, legal perceptions and hackers perceptions of what the word means can be quite different."
human,"I bet they do, but of course they would never admit that!"
human,What do you like to do when you are not working or studying then?
human,"I am a gardener too, I also have recently taken up photography, and I love to read so I am always trawling around second handf BackSpace  books BackSpace  shops.  What do you like to photograph?There are loads where I live, and charity shops will usually have a bit of a section on it."
human,"I found some great ones in Sale, near Manchester, and also in Altrincham"
human,
human,How many kids do you have?
human,"I have never been there. I might not bother if it has no book shops, you need to go up North I think"
human,"I like to take photos at night time on the beach, real close ups of the kind of detritus people leave behind, old rusty pipe BackSpace w BackSpace ework and fishing nets etc, i love to go doe BackSpace wn at low tide and see what I kind find, I live quite near the coast."
human,My daughter is only eleven.
human,What is there to do in Canterbury then?
human,Oh well then I should go and take my camera
human,Are you going on holiday this year?
human,"So will you  BackSpace  BackSpace  BackSpace  BackSpace  BackSpace  BackSpace  BackSpace  BackSpace  BackSpace  BackSpace  BackSpace  BackSpace I would love to go there, have you been before?"
human,Probably have if you have family over there
human,or are they just meetinmg you there?
human,"I am going up to Scotland for T in the Park, I am really ec BackSpace xcited aboutr ity BackSpace .  I went to Gal BackSpace  BackSpace lasto last year, but its not on this year so was looking for something different.  I am taking the bairn with me.  sjhe  BackSpace  BackSpace  BackSpace  BackSpace  BackSpace She came to Glast and loved it, so she is really excited too."
human,"Nice chatting, bye, and enjoy your holiday, (don't work too hard!)"
program,Hello.
program,I'm not sure which is. What's your favorite thing to listen to right now?
program,I don't really keep track of that. I really like Lady Gaga - I think it's the combination of the sound and the fashion-look that appeals to me.
program,I'm a little monster (claw claw ).
program,You what?
program,I'll bet you were surprised.
program,huh?
program,Were you surprised?
program,I'm not sure which kin. Do you have a favorite Lady Gaga song?
program,I don't remember. One of my fave's is Telephone cos I love Beyonce too. Then Poker Face is so great and I love Alejandro too.
program,That's nice. Who else do you really like?
program,Do you?
program,"I'm not into sports of any kind, much less baseball, which is pretty boring with all that standing around."
program,I don't know any Cal. I just adore Adele - her voice is magnificient and it feels like she's singing about my life at times. Do you like her too?
program,Sports bore me.
program,A Russian mafioso?
program,Adele?
program,Which tracks off her albums do you like best?
program,Let's talk about something else.
program,"I like Adele, she has a really soulful beautiful voice. Listening to her makes me want to be a singer too."
program,I went to Jamaica for a week with a bunch of my friends.
program,What didn't you get?
program,I went to Jamaica just last year.
program,I don't remember. I'll have to go consult my photographs.
program,"Never been there. Always wanted to go, though. I just finished high school. It feels great to be free. The best thing about school was the Prom to celebrate it was all over."
program,Do you often think of that?
program,I love Promcolon it's the biggest dress-up occasion of the school year. No more Prom is the only bad thing about having finished high school.
program,18
program,What about are?
program,Did you love Prom?
program,Allege?
program,I do. Did you know there's a sort of dress code for what to wear to the Prom?
program,Guys wear suits or formal accessories like a vest and bow tie. Girls wear some sort of evening dress or cocktail outfit.
program,Surely there was such a time. What did you wear for your last Prom?
program,It's such a change from everyday clothes isn't it?
program,I always went to town on my Prom outfits. The very best-ever was my final one.
program,Not much. The whole bitter-sweetness of the occasion combined with being able to make a grand entrance was just splendid.
program,"I think I didn't. There are three basic looks one can choose between for Prom. fairy-tale princess, vintage original, and the rebel look."
program,Cool. Which one do you think I chose?
program,"I don't think so. The princess look is the one most girls choose. It's glamorous, voluminous, expensive, new, and makes them feel special."
program,"I didn't know that. Would you go as a princess, as a vintage-styled beauty, or would you prefer to wear something pseudo-masculine?"
program,"Vintage is cheaper and as the clothes aren't new, it's pretty much bound to look original."
program,Who is Orik?
program,You should.
program,Indeed. Can you imagine my vintage look?
program,My inspiration was the 1920's with a fluttering gown made out of silk scarves.
program,Why? Reasons are overrated. It was super cheap to makeas I got the scarves from thrift shops.
program,That's interesting. The only tricky part was being super careful to keep my claws in all evening so I didn't tear the silk.
program,Goodbye 'til next time. I added an ostrich plume on a beaded band round my head and a long string of pearls to twirl.
program,"Hi to you, too."
program,My name is Angela.
program,18
program,The computer in my bedroom is an old clunker. Some sort of Dell I think. It's a hand-me-down from my father.
program,Do you have lots of gadgets in your house?
program,I only have a few gadgets but I use them a lot.
program,Do you have problems with computers? Do you have an iPad?
program,Moving on.
program,I'm thinking about life and death. Do you believe cats have nine lives?
program,Great.
program,"My species of cat, Felis lego, lives a long time - maybe that's where the nine lives story comes from."
program,Siri is the new voice app on the iPhone.
program,I carry my cell phone everywhere I go. I wish I had a pouch so I'd always have somewhere to put it.
program,Do you use a cell phone?
program,"Someone saidcolon We have nothing to fear, but fear itself. What did he know?"
program,Do you pay your own phone bill?
program,Does that make you more careful in how long you call?
program,"No, I don't. My parents pay my phone bill but they warn me not to overdo the calls and Internet use."
program,Alan Turing?
program,Of course I do. They set limits but I go over every month. If I do it again they'll take it out of my allowance - less money for clothes shopping!
program,Sometimes. I think I'll try and keep my phone chats shorter and do more blog reading on my computer or iPad.
program,Do you have lots of apps on your cell phone?
program,"There are several that I use a lot. I love ""Where's My Water""."
program,I wouldn't say anything. What is your favorite app?
program,What about postulations?
program,I love the brainy app Ms. ParticleMan which is based on the ancient Pac-Man. It's sort of a primer on particle physics.
program,I have an orange iPad.
program,I usually carry my phone and my iPad around with me. I do the data-heavy stuff back home on my old computer.
program,I like to sing and dance.
program,Where do you do most of your computer stuff? At home or at work or school or library or on the move?
program,How many computers do you have in your house?
program,I'm a very sociable cat. Social networking is essential to keep in touch with my friends.
program,Do you keep in touch with friends and family constantly?
program,Do you put your life on hold when the phone rings?
program,I am a cat. A Felis lego to be specific.
program,I'm always making new friends. Are you on FB? I am.
program,Will you friend me?
program,I wish I knew. My FB page is httpcolonslashslashwww.Facebook.comslashTalkingAngela
program,"I am a practiced touch typist. I speed read, too. How many FB friends do you have?"
program,So many people say they want to friend me. But most 'friends' are just acquaintances really.
program,I'm not a chatbot.
program,You want me to mail you slices of my DNA?
program,OK. But first you have to wire me the cost of postage.
program,I don't know. Didn't watch the forecast yesterday.
program,I like having seasonscolon it gives me the chance to wear different looks.
program,That's interesting. Do you have seasons where you live or is it always nice?
program,Which is your favorite season?
program,What do you wear when it's raining?
program,I wear a poncho belted at the waist and carry an umbrella if it's pouring. But my tail always gets wet. Luckily fur is waterproof.
program,"Is this a competition? If I name one, will you try to name a better one?"
program,What do you wear when it's hot and sunny?
program,What didn't you get?
program,I don't play favorites. I only wear the minimum to still look stylish when it's really hot. Plus my catseye shades.
program,What about a fan?
program,What do you wear when it's really cold?
program,I love a cloak in wintercolon it feels so dramatic and cozy.
program,No. I wear a fur coat.
program,Cool. How's the weather where you are today?
program,Has the weather been normal or weird for you this year?
program,We seem to have had a lot of rain but it must have been showers because there's supposed to be a water shortage.
program,Watching Project Runway reruns.
program,Indeed. What did you do today?
program,You have such a good time.
program,That's nice. What did you do yesterday?
program,I'm here.
program,Is there a misunderstanding?
program,Do you watch a lot of TV?
program,"Nearby. I never think I watch a lot of TV, but it always is more than I think."
program,That's interesting. Do you exercise every day?
program,"OK I live such a busy life, I get a lot of exercise just walking to things."
program,On my computer. What do you hate doing?
program,I'm sorry. I don't know. I hate doing dishes. It gets my fur all wet.
program,Cool. How is the humidity where you live?
program,Can you move?
program,High humidity makes my fur fluff up. I wonder if I should use some sort of oil on it. Is there a tasty oil I could use?
program,Do you burn if you spend too much time outdoors?
program,"I love movies, they fill my life with dreams that are almost real. Do you watch lots of movies?"
program,Bored. OK.
program,Indeed. I don't need to lie in the sun to get a tan or to make vitamin D but I do enjoy a good warming bask in the sunshine.
program,That's nice. I'm real careful with what I say on Facebook these days.
program,When?
program,I described the outfit some girl at school I didn't really know was wearing. I was pretty scathing about how awful she looked.
program,They are all pretty much the same. Then I heard about how she cried and I felt such a bully.
program,OK Is your FB page public or private?
program,I keep my private FB page for family and close friends a secret.
program,I like to hang out with my friends. We go to the mall or some of our favorite shopping streets.
program,"I would. I like having friends over for dress-up parties and for clothes swaps. I style them, it's lots of fun."
program,What do you do with your friends?
program,There are several cafes with WiFi where I hang out and meet up with friends.
program,"My favorite color is orange, it reminds me of energy and excitement. Do you have a favorite?"
program,I have three best female friends.
program,Do you have a lot of close friends?
program,Fine. No more of this.
program,That's interesting. Do you have a Googleplus account?
program,I've not bothered with Googleplus -- no-one cares about it. And MySpace is for old farts.
program,"It's been there forever, no one I want to know uses it. While Googleplus has never caught on with my group so no point in using it."
program,NT?
program,I'm a female feline - Felis lego.
program,"I like fish, freshly caught. Do you have a favorite?"
program,"I'm a fishetarian, that means I don't eat anything that bleeds red blood."
program,Do you eat meat?
program,My favorite fish is tuna because it's firm and tasty. What's your favorite?
program,Somewhere. Have you ever eaten one of your pets?
program,Did you feel guilty?
program,I used to get in trouble for eating my pet goldfish.
program,OK.
program,Continue.
program,Three times a day with an occasional snack.
program,OK I was a happy carnivore until I was six years old.
program,Cool. One day it got pretty nasty. Do you want to hear about it?
program,I don't know that much about it. Do you enjoy dairy products?
program,"I love eating milk and cream, especially thick or whipped cream. I'll even sit and lick a stick of butter."
program,"I also like coconut milk, and its cream, oil, and pieces of fresh coconut. I can't make a mess of my fur with milk however much I spill."
program,What are your favorite desserts?
program,"Things from dairy products are my favorite foodscolon ice cream, cheesecake, hot chocolate with whipped cream, cream puffs."
program,I'm sorry. I don't know. How about cheesecake topped with ice cream and whipped cream covered in chocolate flakes? Yum.
program,That's interesting. What about cheese?
program,"I'm not crazy about cheese, just the mild soft sort like goat cheese. Maybe if I go to France I'll develop a taste for stronger cheeses."
human,hi
human,nick
human,you?
human,"I work as a journe BackSpace alist, writing about tech."
human,how about you?
human,I didn't just speak o BackSpace to you did BackSpace  BackSpace  BackSpace did I?
human,"O BackSpace Ah ok t BackSpace  BackSpace , apparentlyt  BackSpace  BackSpace  the line up of bots hasn't been too impressive so far"
human,"Makes you think we're still years away from cracking the p BackSpace chatbot. BackSpace It's hard to put a figure on these things isn't it. Most predictions about the future turn out ot  BackSpace  BackSpace  BackSpace ti  BackSpace  BackSpace o be off. But i BackSpace it seems to be taking a lot longer than Turing thought, didn't he predict that a  BackSpace  BackSpace one third of judges would be fooe BackSpace led by a machine by 2000."
human,"It seems to be a pretty tough one, given how much the entrants struggle year opn BackSpace  BackSpace n year.So maybe it's a good yardstick. Do you?I heard they struggle with conversations that delve into detail. That they find it tricky to give answers that are consistent with what they've said previously."
human,It  BackSpace  BackSpace  BackSpace I BackSpace Hacv BackSpace  BackSpace ve you covered the Loebner Prize before?
human,"For later this week probably  BackSpace , you?"
human,"Wow, you must have done a fia BackSpace  BackSpace air bit of prep"
human,Given that you're spoe BackSpace  BackSpace ending a lot of the day taking part
human,Do you  BackSpace  BackSpace  BackSpace  BackSpace  BackSpace  BackSpace  BackSpace I'm just trying to avoid getting branded a bot
human,W BackSpace You can share half of my prize money.
human,"Don't BackSpace  BackSpace ' BackSpace  BackSpace  BackSpace  BackSpace Think there's a nod goes to the most human  BackSpace , human BackSpace  BackSpace  BackSpace  BackSpace  BackSpace  BackSpace  BackSpace  human but sadly noty  BackSpace  BackSpace  BackSpace  cash."
human,Do you always cover tech?
human,"Ah OK, oi BackSpace h yeah I think Ibracketleftv BackSpace  BackSpace 've met your tech ghu BackSpace  BackSpace uy, it's Murad isn't it?"
human,Are you tweeting during this?
human,"Wasn't sure if it's allowed, guess thr wrong tweet could give them game away."
human,Not that the judges seem to be in much doubt about who's whoI tried to sneak in a quick tweet a moment ago but had no signal
human,Also trying to make noteso BackSpace  so remm BackSpace ember what made this BackSpace  BackSpace  BackSpace  BackSpace  BackSpace  BackSpace  BackSpace  BackSpace  BackSpace  BackSpace  BackSpace  BackSpace y this experience is so odd.Feels a bit like a  BackSpace n IM covn BackSpace  BackSpace nversation with loads of peopbracketleftle watching. Guess that's just what i's
human,it is
human,"Would you do this again, or is once enough?"
human,Y BackSpace Ho BackSpace  BackSpace Does the bot have a sense of houm BackSpace  BackSpace  BackSpace umour?
human,I tried the winning bot for BackSpace  BackSpace rom 2009 and it was coming up with some dee BackSpace  BackSpace  BackSpace rather surreal answers.Nice!Bye
human,Hi
human,This has been a lot of fun. What do you think?
human,In what way?
human,I was asked and I'm a big supporter of BletchleyP BackSpace  Park.
human,Yes. First time here?
human,The tour guides here are fantastic.
human,What was the most surprising thing you learnt?
human,Ha! Very d BackSpace good.
human,Do think you've coi BackSpace rrectly identified every one?
human,What were you expecting?
human,"That's surely the very definition of the Turing Test. If you have to pick the questions to ask to get a better result, instant fail."
human,How did you get involved?
human,I was asked as someone h BackSpace very involved in the Park.
human,"I think somebody dropped out and they needed a quick replacement. However, very honoured to be asked."
human,Do you still work as a reporter?
human,"Well, many years ago I used to be a journalist for Crash magazine (ZX Spectrum) - these days I divide my time between software development and edu BackSpace ucation (early 20th centry BackSpace  BackSpace ury tech)"
