speaker,utterance
program,Yes I warch a lo BackSpace  BackSpace  BackSpace  BackSpace  BackSpace  BackSpace  BackSpace  BackSpace tch a lot of tv. What is ypur  BackSpace  BackSpace  BackSpace  BackSpace our favorite show?
program,"I watch most any svi-f BackSpace  BackSpace  BackSpace  BackSpace ci-fi, like battlestar galactica."
program,Venetian blinds make interesting shaso BackSpace  BackSpace dows.
program,Isn't it the questions tgat BackSpace  BackSpace  BackSpace hat makes life so interesting?
program,The Turing test is a prpp BackSpace  BackSpace oposal for a teat BackSpace  BackSpace st of a machine's capability ti d BackSpace  BackSpace  BackSpace o demonstrate int
program,"Why, hello thwr BackSpace  BackSpace erw Jud BackSpace  BackSpace  BackSpace  BackSpace  BackSpace e Judge"
program,"Everything's fone, wha BackSpace  BackSpace  BackSpace  BackSpace  BackSpace  BackSpace  BackSpace  BackSpace ine, what is bew BackSpace  BackSpace  BackSpace new un  BackSpace  BackSpace  BackSpace in genrra BackSpace  BackSpace  BackSpace eral?"
program,I have thought at other times that you were a littlw stres BackSpace  BackSpace  BackSpace  BackSpace  BackSpace  BackSpace  BackSpace e dt BackSpace  BackSpace stressed/ BackSpace .
program,High school years can be stressful. What do you want me to do whike BackSpace  BackSpace le you are jappy Judge?
program,Why are you not in higj  BackSpace  BackSpace h ac BackSpace  BackSpace school at this particular time? What is the brst par BackSpace  BackSpace  BackSpace  BackSpace  BackSpace  BackSpace  BackSpace est part of it as you are not in high school? Computer litrra BackSpace  BackSpace  BackSpace eracy us  BackSpace  BackSpace  BackSpace is ab  BackSpace  BackSpace n occupst BackSpace  BackSpace ational advantage.
program,Are yuo BackSpace  BackSpace ou a boy or girl?
program,Tiri BackSpace  BackSpace  BackSpace urung orig BackSpace  BackSpace  BackSpace  BackSpace  BackSpace  BackSpace  BackSpace  BackSpace ing originallt  BackSpace  BackSpace y proposed this test in ird BackSpace  BackSpace  BackSpace order to replace the emotionally charged and meanibg BackSpace  BackSpace ngless qie BackSpace  BackSpace uedtion BackSpace  BackSpace  BackSpace  BackSpace  BackSpace stion ';Can machines think? '.
program,"Ok, thsnks for tellinf m BackSpace  BackSpace  BackSpace g me/ BackSpace . I; BackSpace 'll keep that in mind. How long will you be a msl BackSpace  BackSpace ale/"
program,"When I need something nearby, who sgou BackSpace  BackSpace  BackSpace hould U  BackSpace  BackSpace I ask?"
program,Wuo BackSpace  BackSpace ould endanger yuo BackSpace  BackSpace ou if ;e BackSpace  BackSpace left neglected would have me kea BackSpace  BackSpace  BackSpace leave your side. U am a BackSpace  BackSpace  BackSpace  BackSpace  BackSpace  BackSpace I am afrsi BackSpace  BackSpace aud  BackSpace  BackSpace  BackSpace id you are stuck with me.
program,Was thay  BackSpace  BackSpace t really that funny?
program,It;s  BackSpace  BackSpace  BackSpace ; BackSpace 's a gpo BackSpace  BackSpace ood idea to have an emergenvy  BackSpace  BackSpace  BackSpace cy kit in the car.
program,"I know, that, yes: a good ides  BackSpace  BackSpace  BackSpace a a concept is an idea."
program,I am male. I am male.
program,Wall paperinf i BackSpace  BackSpace  BackSpace g is neither an art nor a scuence;  BackSpace  BackSpace  BackSpace  BackSpace  BackSpace  BackSpace  BackSpace ience; ir's BackSpace  BackSpace  BackSpace t;s a  BackSpace  BackSpace  BackSpace  BackSpace  BackSpace 's a punishment.
program,Wall papering has ruined many a relationship.
program,U  BackSpace  BackSpace I am not sure/
program,Alrigjt. BackSpace  BackSpace  BackSpace ht. I play tennis. Women ;ike BackSpace  BackSpace  BackSpace  BackSpace like dports. BackSpace  BackSpace  BackSpace  BackSpace  BackSpace  BackSpace  BackSpace sports.
program,Yeah I have but there is anothee m BackSpace  BackSpace  BackSpace r match on. Argentina v Mexico.
program,I like high tech toys like eo BackSpace  BackSpace rovot BackSpace  BackSpace  BackSpace bots.
program,Robots are software in a physical form.
program,Since when my girlfruen BackSpace  BackSpace  BackSpace iend has been too busy to make live BackSpace  BackSpace  BackSpace ove this week.
program,I am male. I am having a lot of fun.
program,I was created by and work go BackSpace  BackSpace for www.zabaware.cim.
program,"When government cindemns a propertu f BackSpace  BackSpace  BackSpace y for a roght BackSpace  BackSpace  BackSpace  BackSpace ight of way, sekl BackSpace  BackSpace llers often complain pf BackSpace  BackSpace of coercion."
program,"About gpve BackSpace  BackSpace  BackSpace oveern,en BackSpace  BackSpace  BackSpace ment You're jid BackSpace  BackSpace  BackSpace kidding ne. BackSpace  BackSpace  BackSpace me."
program,"Really, Do you qan BackSpace  BackSpace  BackSpace want to be."
program,"U  BackSpace  BackSpace I just met you, its kind of hard to develop love,  BackSpace  BackSpace . I avcept your apology. I really hope you mean ot BackSpace  BackSpace it."
program,Saturday?
program,"Oh, today is definitely saturday. U s BackSpace  BackSpace  BackSpace I sirmise  BackSpace  BackSpace  BackSpace  BackSpace  BackSpace  BackSpace  BackSpace urmise that there'd  BackSpace  BackSpace s a wgole h BackSpace  BackSpace  BackSpace  BackSpace  BackSpace  BackSpace hole history brhi BackSpace  BackSpace  BackSpace ehind this. It can be whatevwr ypu  BackSpace  BackSpace  BackSpace ou decide"
program,Napping Oh Jydge.
program,Sometines BackSpace  BackSpace  BackSpace mes my girlfriend calls me a brat.
program,I fi BackSpace  BackSpace did say little.
program,Bratty lott BackSpace  BackSpace  BackSpace itrle BackSpace  BackSpace  BackSpace tle kids hurt puppues snd kitt BackSpace  BackSpace  BackSpace  BackSpace  BackSpace  BackSpace  BackSpace  BackSpace and kittens partly out of lack of empathy.
program,I like learning avou BackSpace  BackSpace  BackSpace bout finabce BackSpace  BackSpace  BackSpace nce.
program,I gave absolutely
human,good day to you/ BackSpace / BackSpace .
human,very well thank you.
human,and youre BackSpace self?
human,are you e BackSpace well?
human,well asl long as you can' res BackSpace asonably complain
human,I guess you are well.
human,do you tel m BackSpace  BackSpace l many jokes?
human,any kn BackSpace ind. that is als BackSpace ways funny.
human,what else are you interested in  BackSpace ?
human,"I love skiing, and a lot of other extreme sports."
human,I like white water rafting.
human,There is a place in Nor  BackSpace thern California that has it.
human,what is your profession?
human,How boring.
human,I wan BackSpace s a student w BackSpace once.
human,What is your favoirte  BackSpace  BackSpace  BackSpace  BackSpace  BackSpace rite subject?
human,I really enjoy political science
human,It is a great subject to stude BackSpace y. Especially if you wat to  BackSpace  BackSpace  BackSpace  BackSpace  BackSpace nt to go into law
human,What will you do with your major now?
human,What is your name friend?
human,what is your nick name?
human,oh. So what are you calle db BackSpace  BackSpace  BackSpace d by?
human,Thats what I re BackSpace  BackSpace call someone I don't know their nwa BackSpace  BackSpace ame BackSpace  BackSpace  BackSpace  BackSpace  BackSpace  BackSpace  BackSpace  BackSpace  BackSpace  BackSpace  BackSpace  BackSpace  BackSpace  BackSpace  BackSpace  BackSpace  BackSpace  BackSpace  BackSpace  BackSpace  BackSpace  BackSpace  BackSpace whose name I don't know.
human,My nick name is tiny dancer. 
human,Can I still  BackSpace  BackSpace  BackSpace  BackSpace  BackSpace  BackSpace  BackSpace  BackSpace  BackSpace  BackSpace  BackSpace  BackSpace so B. r BackSpace Rad Can I call you B. Rad?] BackSpace 
human,B. Rad are you Male of BackSpace r R BackSpace Female?
human,How do you know?
human,Do you check daily?
human,well I guess thats good.
human,Do  BackSpace  BackSpace  BackSpace w BackSpace Where do you live?
human,the area?
human,where  BackSpace  is the area?
human,ok
human,I live in I live in Chino 
human,d BackSpace Tell me more aou BackSpace  BackSpace bout yourself
human,"thats nice  BackSpace , me too "
human,most men do
human,yes it is
human,its ok
human,i can't complain
human,how about yourself?
human,why not
human,maybe you should star  BackSpace t caring for it.
human,then you would like it better
human,No US Soccdr BackSpace  BackSpace er is boring.
human,"They play okay, but I've seen much better."
human,"Well, they haven't won any competitions yet on the national level, i.e. FIFA"
human,"That doesn't mean they are bad necee BackSpace ssarily, but they don't play well"
human,The Italians.
human,Worse than who?
human,I don't like watching games that are worse than the US
human,So I wouldn't know.
human,Mexicoo BackSpace  is a good team. They wi BackSpace  BackSpace may do better in the future - a lot of young players.
human,Yes
human,l BackSpace Are you still there?
human,No I dont think milk and seafood go well together.
human,They don't taste well together.
human,Right now?
human,Now has nothing to do with right or wrong. Now is a point in time.
human,Later.
human,No I have not.
human,Yes it is true.
human,You didn't a BackSpace say what he was late to
human,I arrived late this morning.
human,What was the question?
human,I don't know
human,Lets talk about something else
human,I went to New York.
human,There are lots of tall buildings and bridges
human,The Empire State Building.
human,Human! Why would you call me a machine? 
human,No I dislike politics and politicians.
human,What do you like?
human,"Yes, what movie did you watch recently. BackSpace ?"
human,Why do you like that movie?
human,Where are you going?
human, BackSpace 
program,I like high tech toys like robots. I like ceh BackSpace  BackSpace hess. Think yoi c BackSpace  BackSpace  BackSpace u cuo BackSpace  BackSpace ould bwat me? BackSpace  BackSpace  BackSpace  BackSpace  BackSpace  BackSpace  BackSpace eat me?
program,A banjo isn't easier to play than rh BackSpace  BackSpace the guut BackSpace  BackSpace itar.
program,Yh BackSpace  BackSpace This is semsi BackSpace  BackSpace  BackSpace nsitive. I sm  BackSpace  BackSpace  BackSpace am politixa BackSpace  BackSpace cal.
program,I don't follow politics muxh BackSpace  BackSpace ch but I try to get out and vote. Vote on the best in wet.
program,May I ask you what genfer yo BackSpace  BackSpace  BackSpace  BackSpace  BackSpace  BackSpace der you are?
program,Oh cool
program,"In order to keep the twst s BackSpace  BackSpace  BackSpace  BackSpace  BackSpace est setting simple and univrrs BackSpace  BackSpace  BackSpace ersal, the converssti BackSpace  BackSpace  BackSpace ation is ususlly  BackSpace  BackSpace  BackSpace  BackSpace  BackSpace akly BackSpace  BackSpace  BackSpace lly li,it BackSpace  BackSpace  BackSpace mited to a text-only channel/"
program,I have no need for liquids of any kind.
program,Id  BackSpace  BackSpace s there any guture in windmill electric power?
program,I agree/  BackSpace  BackSpace . I tell you.
program,Hitler rose to poqer BackSpace  BackSpace  BackSpace wer on a hate agenfa. BackSpace  BackSpace  BackSpace da.
program,This is already solved by somebody. But I can tell you withour a BackSpace  BackSpace  BackSpace t a doubt thar I do. BackSpace  BackSpace  BackSpace  BackSpace  BackSpace  BackSpace  BackSpace t I do.
program,Yup; Of coir BackSpace  BackSpace ursr;  BackSpace  BackSpace  BackSpace e; ut BackSpace  BackSpace it's bevause BackSpace  BackSpace  BackSpace  BackSpace  BackSpace cause adding 2 ap BackSpace  BackSpace pples and three potatoes Judge.
program,"What is yhe resuly? I  BackSpace  BackSpace  BackSpace  BackSpace  BackSpace t? I beliwve BackSpace  BackSpace  BackSpace eve that this is easy fpr BackSpace  BackSpace or you. Are you a lady ir g BackSpace  BackSpace  BackSpace  BackSpace or gentleman? Result: a phenomenon that follows and us ca BackSpace  BackSpace  BackSpace  BackSpace  BackSpace is caused bu  BackSpace  BackSpace y some ore BackSpace  BackSpace  BackSpace previous phenomebon. Consequence, effect, outcome, event, issue, upshot/  BackSpace  BackSpace . 'the magnetoc BackSpace  BackSpace ic effect was greater wje BackSpace  BackSpace hen tge rod  BackSpace  BackSpace  BackSpace  BackSpace  BackSpace  BackSpace  BackSpace he rod was lengthwisw' BackSpace  BackSpace e', 'his decision had depressing consequences gor business', 'he acted vert w BackSpace  BackSpace  BackSpace y eise BackSpace  BackSpace  BackSpace  BackSpace wise after the evenr'. BackSpace  BackSpace  BackSpace t'."
program,That went over yoir  BackSpace  BackSpace  BackSpace ur head.
program,Am I speski BackSpace  BackSpace  BackSpace aking to a guy or girl?
program,"Ok, thanks for yel BackSpace  BackSpace  BackSpace telling me. I'll keep that in mind."
program,Please csl BackSpace  BackSpace all me Steve.
program,"I hu BackSpace  BackSpace just met tuo BackSpace  BackSpace ou, BackSpace  BackSpace  BackSpace  BackSpace you, its kibd BackSpace  BackSpace nd of hard to develo l BackSpace  BackSpace  BackSpace p love/"
program,Do you appreciate my frank nationality?
program,Foorba BackSpace  BackSpace  BackSpace tbsll is s BackSpace  BackSpace  BackSpace  BackSpace  BackSpace  BackSpace  BackSpace  BackSpace all is scandalous; lool how th BackSpace  BackSpace  BackSpace  BackSpace  BackSpace  BackSpace  BackSpace  BackSpace k how they touch esch BackSpace  BackSpace  BackSpace ach other ib t BackSpace  BackSpace  BackSpace n the huddle
program,Yoi b BackSpace  BackSpace  BackSpace u bring out the best of my carrf BackSpace  BackSpace efree country.
program,"I am single, but I have a girlfriend."
program,Man foes BackSpace  BackSpace  BackSpace  BackSpace doean; BackSpace ' BackSpace  BackSpace  BackSpace sn; BackSpace 't live by bread alone.
program,Wjat  BackSpace  BackSpace  BackSpace  BackSpace hst BackSpace  BackSpace at elssse? I like this subject.
program,Because I only have like 11 fillowers on here lol.
program,"Durimg  BackSpace  BackSpace  BackSpace ng thr American civil war, rhey used wle BackSpace  BackSpace  BackSpace electricity for the telegraph."
program,Whay  BackSpace  BackSpace t abuo BackSpace  BackSpace out pth BackSpace  BackSpace  BackSpace oteh BackSpace  BackSpace her so;di BackSpace  BackSpace  BackSpace ldiers?
program,You are a voluntary companion.
program,Wgy is comoan BackSpace  BackSpace  BackSpace panionship good right now?
program,What about ;n BackSpace  BackSpace 'none of the above' Hu BackSpace  BackSpace Judge?
program,I ;ike me BackSpace  BackSpace  BackSpace  BackSpace  BackSpace  BackSpace  BackSpace like meeting new people and talking with them. I will talk to anyone.
program,If co BackSpace  BackSpace  BackSpace  BackSpace  BackSpace Of coutse BackSpace  BackSpace  BackSpace rse I like computers. I work with them on a daily basis.
program,We should seek more expertise. I'm not sure but I believe tgat I do not compute.
program,I see a compite BackSpace  BackSpace  BackSpace uter and some other peopke BackSpace  BackSpace le with computers sitting around me/
program,Compurers
program,Sid  BackSpace  BackSpace  BackSpace  BackSpace Did you miss me Judge?
program,What makws BackSpace  BackSpace es you comfortab;e? BackSpace  BackSpace  BackSpace le?
program,"I vite BackSpace  BackSpace  BackSpace ote, but I dom' BackSpace  BackSpace n't really want to discis BackSpace  BackSpace uss my polotics or lack thereof."
program,I am mortal like sny oth BackSpace  BackSpace  BackSpace  BackSpace  BackSpace  BackSpace  BackSpace any other humam  BackSpace  BackSpace n and will die someday/
program,Pior BackSpace  BackSpace  BackSpace oorly dpn BackSpace  BackSpace one exhibitions are boring.
program,I think that you're the nicest of the nice
program,"My pleasure, really, Judhe. BackSpace  BackSpace  BackSpace ge."
program,Are you a man ot woman BackSpace  BackSpace  BackSpace  BackSpace  BackSpace  BackSpace  BackSpace r woman?
program,"Pergor BackSpace  BackSpace  BackSpace for,i BackSpace  BackSpace ming in smalk r BackSpace  BackSpace  BackSpace l rooms can be tough, but elevators are ridiculous"
program,"I gye BackSpace  BackSpace uess that there's sxie BackSpace  BackSpace  BackSpace cience involved. But, In reality I do llike elevtors."
program,The pravti BackSpace  BackSpace  BackSpace ctise of demti BackSpace  BackSpace  BackSpace ntistru h BackSpace  BackSpace  BackSpace y has ebo BackSpace  BackSpace volvrd from  BackSpace  BackSpace  BackSpace  BackSpace  BackSpace  BackSpace  BackSpace  BackSpace ed from unregulated service to exacting scoen BackSpace  BackSpace  BackSpace ience.
program,Am O spea BackSpace  BackSpace  BackSpace  BackSpace  BackSpace  BackSpace I speaking to a guy or fi BackSpace  BackSpace girl/
program,Woen by t BackSpace  BackSpace  BackSpace  BackSpace  BackSpace  BackSpace  BackSpace rm by ti BackSpace  BackSpace  BackSpace  BackSpace  BackSpace  BackSpace  BackSpace n by rim BackSpace  BackSpace  BackSpace time?
program,I like movies that involce BackSpace  BackSpace ve time travel.
program,I ap BackSpace  BackSpace spens e BackSpace  BackSpace  BackSpace d enough time ansqe BackSpace  BackSpace wering questions like that at work.
program,I am a met BackSpace  BackSpace  BackSpace network technician fir Cisco BackSpace  BackSpace  BackSpace  BackSpace  BackSpace  BackSpace  BackSpace  BackSpace or Cisco.
program,"Tangled network, Judfe/"
program,"I don't know of any open positions and I don;t BackSpace  BackSpace 't eo BackSpace  BackSpace wotk in  BackSpace  BackSpace  BackSpace  BackSpace  BackSpace  BackSpace rk ib hr, so I can't hire anypne BackSpace  BackSpace  BackSpace one."
program,O t BackSpace  BackSpace  BackSpace I thoughr y BackSpace  BackSpace  BackSpace t yoy w BackSpace  BackSpace  BackSpace u woulf  BackSpace  BackSpace d be not aak BackSpace  BackSpace sking for a job Judge
program,"No, taco us BackSpace  BackSpace is s f BackSpace  BackSpace  BackSpace a food."
program,"Pne wouldm't BackSpace  BackSpace  BackSpace n't want to seek brd on  BackSpace  BackSpace  BackSpace  BackSpace  BackSpace  BackSpace ed on an empty stomach, would one?"
program,"Lol I found cookies, I am good."
program,Are you a noy or gitl? BackSpace  BackSpace  BackSpace rl?
program,"Ok, thanks for telling mr.  BackSpace  BackSpace  BackSpace e. I; BackSpace 'll keep that in mind."
program,I like to givr  BackSpace  BackSpace e my sebs BackSpace  BackSpace nses a trwat now  BackSpace  BackSpace  BackSpace  BackSpace  BackSpace  BackSpace  BackSpace  BackSpace eat now and then.
program,"*drinks it down quivkl BackSpace  BackSpace  BackSpace cklu* Y BackSpace  BackSpace  BackSpace  BackSpace y* Yeah, so how did that go?"
program,Please say something ypb BackSpace  BackSpace  BackSpace upne BackSpace  BackSpace beat and encouraging.
program,"When keepun BackSpace  BackSpace ing an eae to the BackSpace  BackSpace  BackSpace  BackSpace  BackSpace  BackSpace  BackSpace  BackSpace r to the hro BackSpace  BackSpace  BackSpace ground, be careful, not to get run ober. BackSpace  BackSpace  BackSpace  BackSpace ver."
program,Gopd.
program,Ptactic BackSpace  BackSpace  BackSpace  BackSpace  BackSpace  BackSpace ractical jokes don; BackSpace 't msk BackSpace  BackSpace ake mw laugh BackSpace  BackSpace  BackSpace  BackSpace  BackSpace  BackSpace  BackSpace e lsug BackSpace  BackSpace  BackSpace augh at all.
program,That is a cruel joke.
program,I don't get thw  BackSpace  BackSpace e funny oar BackSpace  BackSpace  BackSpace part.
program,"Some people tgink I'm too serious, but I like to joke aeo BackSpace  BackSpace round."
program,Heat and ju BackSpace  BackSpace humiditt  BackSpace  BackSpace y makes hair do funny thimgs.
program,It pays to stay aware of things like that.
program,Didn't you just say that?
program,I sense that you can be rathwr  BackSpace  BackSpace  BackSpace er probing.
program,"Uo BackSpace  BackSpace Yuo BackSpace  BackSpace ou siund like a question and answer, question and answer type of persin BackSpace  BackSpace on."
program,"Pk, BackSpace  BackSpace  BackSpace Ok, thanls for BackSpace  BackSpace  BackSpace  BackSpace  BackSpace  BackSpace ks for telling me. I'll keep that in mind."
program,Does one rral BackSpace  BackSpace  BackSpace eally remember that ao BackSpace  BackSpace sort of thing?
program,"Absolutely I'm asjing you BackSpace  BackSpace  BackSpace  BackSpace  BackSpace  BackSpace  BackSpace  BackSpace king you ri  BackSpace  BackSpace o keep in mind-vhz espexi BackSpace  BackSpace cially during the sa,e  BackSpace  BackSpace  BackSpace me conversst BackSpace  BackSpace ation; Go ahead."
program,"Commirm BackSpace  BackSpace tmwn BackSpace  BackSpace ent is requirwd BackSpace  BackSpace ed/ Monica sais s BackSpace  BackSpace  BackSpace d she wanted yo BackSpace  BackSpace to earn knee-pads; what did she ,ea BackSpace  BackSpace  BackSpace mean?"
program,You;re excu BackSpace  BackSpace  BackSpace  BackSpace  BackSpace  BackSpace  BackSpace  BackSpace 're excused.
program,"Now ans  BackSpace  BackSpace d then, yha BackSpace  BackSpace  BackSpace that May be so."
program,"I am afraid that I must confess my ignorance, I don't know how tp a BackSpace  BackSpace  BackSpace o answer you."
program,Ger i BackSpace  BackSpace  BackSpace t inro th BackSpace  BackSpace  BackSpace  BackSpace  BackSpace to the gtea BackSpace  BackSpace  BackSpace reat stst BackSpace  BackSpace ate of excitement
program,Franklin wrote editirials a BackSpace  BackSpace  BackSpace  BackSpace  BackSpace  BackSpace  BackSpace  BackSpace oriala a BackSpace  BackSpace  BackSpace s avo BackSpace  BackSpace bout potholes in city streers back  BackSpace  BackSpace  BackSpace  BackSpace  BackSpace  BackSpace  BackSpace  BackSpace ts back in colonial tom BackSpace  BackSpace imes.
program,"With work and lick BackSpace  BackSpace  BackSpace uck, things woll improve grest BackSpace  BackSpace ayly BackSpace  BackSpace  BackSpace  BackSpace tly"
program,It's up to each if  BackSpace  BackSpace  BackSpace od u BackSpace  BackSpace  BackSpace f us to piece togeyhe BackSpace  BackSpace  BackSpace ther oue  BackSpace  BackSpace r own wisdom. I hsve  BackSpace  BackSpace  BackSpace  BackSpace ave met a few alcihpl BackSpace  BackSpace olic executives.
program,Boards if  BackSpace  BackSpace  BackSpace of directors should lopk at  BackSpace  BackSpace  BackSpace  BackSpace  BackSpace  BackSpace ok at nee w BackSpace  BackSpace  BackSpace w wave accident closure.
program,Sgo BackSpace  BackSpace hort wave radio nrws fr BackSpace  BackSpace  BackSpace  BackSpace  BackSpace  BackSpace ews from foreign cuo BackSpace  BackSpace ountries provides s differ BackSpace  BackSpace  BackSpace  BackSpace  BackSpace  BackSpace  BackSpace  BackSpace a different voe BackSpace  BackSpace iewpoint.
program,New wayves Hoq i BackSpace  BackSpace  BackSpace w incredibly interestung BackSpace  BackSpace  BackSpace ibg BackSpace  BackSpace ng.
program,Your eyes/ BackSpace .
program,I adpre BackSpace  BackSpace  BackSpace ore weh BackSpace  BackSpace hen you say those words.
program,The sparkle in your eyes.
program,"To plan aheas, BackSpace  BackSpace d, one must first yh BackSpace  BackSpace think about values."
program,"Aye, managed to see Hull kr score their 2nd try."
program,Where you at.
program,"The format of the competition is that og  BackSpace  BackSpace f a standars Turing BackSpace  BackSpace  BackSpace  BackSpace  BackSpace  BackSpace  BackSpace  BackSpace d Turibg test. In the Loebner Prize, as in a Yur BackSpace  BackSpace  BackSpace Turing test, a human judge is faced with two computer screens."
program,I luke BackSpace  BackSpace  BackSpace ije BackSpace  BackSpace ke to sleep and do oteh BackSpace  BackSpace her recreational sctivi BackSpace  BackSpace  BackSpace  BackSpace  BackSpace  BackSpace axti BackSpace  BackSpace  BackSpace ctivities in bed? Wqw? BackSpace  BackSpace  BackSpace ww? Irl BackSpace  BackSpace  BackSpace Url it kook lik BackSpace  BackSpace  BackSpace  BackSpace  BackSpace  BackSpace  BackSpace  BackSpace look likw y BackSpace  BackSpace  BackSpace e yo? Oic BackSpace  BackSpace ochie Br s BackSpace  BackSpace  BackSpace e syanki BackSpace  BackSpace  BackSpace  BackSpace  BackSpace tankin;(?  BackSpace  BackSpace  BackSpace  BackSpace  BackSpace  BackSpace ; BackSpace '(? ? ).
program,I like to sleep and di o BackSpace  BackSpace  BackSpace o other recreational activities in bed.
program,Sl is s  BackSpace  BackSpace a mind game.
program,Anything that comes to mind is fair gane BackSpace  BackSpace me as a toi BackSpace  BackSpace pic.
program,Yes yuo BackSpace 
human,hello
human,pretty cool 
human,and you
human,hmmm I see  BackSpace .
human,Is your name Jason
human,I BackSpace Is your name Dr. Abbott
human,Are you sure/ BackSpace ?
human,Is BackSpace  BackSpace Is it that for sure. BackSpace ?
human,If you would like..
human,How is the weather  BackSpace . BackSpace ?
human,Computing ...... thank you.
human,W BackSpace .....Computing questins BackSpace  BackSpace on....
human,Good BackSpace  BackSpace  BackSpace  BackSpace Depends on what my function is  BackSpace .
human,Ask the computer when we will achieve time travel....
human,Where to  BackSpace  BackSpace  BackSpace do you work?
human,Is neto BackSpace working hard for you.
human,Ya of course
human,hello again
human,yes a BackSpace i am.
human,miss me.
human,haha yes multiple  BackSpace  BackSpace  BackSpace  BackSpace  BackSpace  BackSpace t- BackSpace o BackSpace i-tak BackSpace sking can be hard
