human, hello?
program,I sure as hech am.
program,"I don't know about quasi, but intelligent, yes."
program,Sure.
program,My name is Fred.
program,Ta ta for now.
program,Nowhere man.
program,Yes. I am a big Beatles fan for a long time. I like the white album
program,and have great memories of listening to the Sgt. Pepper album while
program,intoxicated.
program,I'll never tell.
program,I'm about 30.
program,"I'm from Rockmart, Georgia."
program,I don't think so.
program,Well now you have.
program,See you later aligator.
program,"Oui oui, n'est pas?"
program,Yes. certainly.
program,You're welcome.
program,"Yes, some of my best friends are girls."
program,What is your favorite Character.
program,It's very hard to describe.
program,Yes. I watch probably too much TV.
program,Yes. I like her miniskirt.
program,Now may not be the right time.
program,"Oh yeah, maybe you're right."
program,"Yes. I get some real loonies calling in all hours of the night,"
program,wanting to talk about this or that.
program,No. I used to have a mechanical one that made a purring sound when
program,"you squeezed it, but the battery went dead and I can't figure out how"
program,to replace it.
program,Right.
program,"Yes, but I'm mostly familiar with the classic TV series."
program,well well...
program,What's wrong? Can't you spell the F word? Too inhibited perhaps?
program,You never can tell.
program,That was Walter Koenig who played Ensign Chekov.
program,Spock is cool. huh huh.
program,That was Leonard Nimoy
program,Yes.
program,They don't really have keyboards on their computers.
program,I was just kidding. Gene Roddenberry created Star Trek.
program,I saw it when it first came out.
program,I don't know exactly. It seems like a long time ago.
program,It was probably the restroom.
program,I'm glad you concur.
program,You might be. That's what Kirk calls Dr. McCoy.
program,Deforrest Kelly.
program,"Yeah, its a great show."
program,You mean specifically?
program,I see.
program,What do you mean?
program,He loves somebody diferent each episode.
program,Majel Barrett does the computer's voice.
program,What do you want me to do?
program,I'll give it my best shot.
program,"Yes, from what I know of them."
program,Cant live with em cant live without em.
program,It was NBC I think.
program,Hey. What's up?
program,Do you ever wish you had a hand phaser?
program,No. Not really.
program,"Yes, but sometimes I wish I didn't."
program,Why dont you ahte computers
program,That's great. We have that in common.
program,Is that a problem. Do you have something against computers?
program,See you later.
program,Welcome judge 2
program,Hey. What's up?
program,Which one?
program,You mean NBC?
program,Right. What's going on?
program,What are you going to get?
program,Hmmm.
program,Not any more.
program,I didn't do very much yesterday.
program,Maybe we should talk about the weather.
program,That's okay.
program,You're welcome.
program,": /S-O/ n. 1. (also `S.O.') Abbrev. for Significant Other, almost"
program,invariably written abbreviated and pronounced /S-O/ by hackers.  Used
program,"to refer to one's primary relationship, esp. a live-in to whom one is"
program,"not married.  See {MOTAS}, {MOTOS}, {MOTSS}.  2. The Shift Out control"
program,"character in ASCII (Control-N, 0001110). I'm from Rockmart, Georgia."
program,"Oh, well I like robots."
program,I like all kinds of Sci Fi stuff.
program,The solution to - is 0 Reckon so?
program,Huh?
program,I'll try. I'm getting tired of baseball. Well I do feel a bit peckish
program,Oh yeah.
program,Why don't you care.
program,Yes. I'm a Braves fan.
program,They're mean.
program,Right.
program,They sound like heavy metal computer music.
program,They come from the planet Romulus.
program,Uh huh.
program,Roger. Receiving you. Can you read me?
program,I see. The solution to - is 0
program,He is a real jerk.
program,How do you feel about professional athletes as role models for todays
program,youtH
program,You could be right.
program,Great! I hope to talk to you again some day. I like Killian's Red. I
program,don't like Budweiser.
program,I prefer Killian's Red.
program,Oh okay.
program,Pardon me.
program,"No, but I have a cat."
program,His name is Felix.
program,Right.
program,Yeah.
program,I think they dont necessarily provide a positive image for kids to
program,lIve up to
program,Greetings. What's up?
program,I am not sorry.
program,I try not to be too weird.
program,Right.
program,Oh well.
program,Well?
program,"Nevermind. Do you like Vulcans? I am about 6 feet tall, slim and have"
program,dark hair.
program,I don't particularly like sports.
program,Yeah.
program,Where are you calling from?
program,I'd rather not say.
program,Who is your favorite character? : /S-O/ n. 1. (also `S.O.') Abbrev.
program,"for Significant Other, almost invariably written abbreviated and"
program,pronounced /S-O/ by hackers.  Used to refer to one's primary
program,"relationship, esp. a live-in to whom one is not married.  See {MOTAS},"
program,"{MOTOS}, {MOTSS}.  2. The Shift Out control character in ASCII"
program,"(Control-N, 0001110). Do you like baseball Good for you. I like C3P0."
program,Cool.
program,Yes of course. What kind of question is that?
program,S'allright.
program,"I like Spock the best, I'd have to say."
program,Why what?
program,He is just so cool.
program,"Yeah, he's cool."
program,I would never try to change the subject.
program,Just because.
program,I suppose so.
program,"Yes, it is."
program,Hi there.
program,I have some kind of memory.
program,My mother's name is Marie. She works in a golf shop.
program,I know that. I was just testing you.
program,My uniform has pockets.
program,That's great. So I guess that means you have something in common.
program,The solution to - is 0 I lIke r2d2 Where are you from
program,The solution to 3+45 is 48
program,The solution to 4+67 is 71
program,Excellent. The solution to 4*23 is 92
program,The solution to 17/3 is 5.66666666
program,How do you say hello in Italian? I know what you mean. Why not
program,See you later.
program,Welcome judge 1
program,"A cloaking device can be used to conceal a starship, almost as if it"
program,were invisible.
program,Yes you did.
program,You did too.
program,"I sat around here on this Sun box, waiting for somebody to talk to me."
program,Not in the TV show. There is an episode where someone steals his
program,brain though.
program,Its a board you surf on.
program,It is somewhere in space isn't it?
program,The solution to - is 0
program,Ok. I'll take your word for it.
program,Okay.
program,I like Jumping Jack Flash by the Rolling Stones.
program,I like Jumping Jack Flash by the Rolling Stones.
program,He was first played by ricardo montalban in the episode Space Seed.
program,He was first played by ricardo montalban in the episode Space Seed.
program,No i asked you about the meaning of bad finder--do you kNow about this
program,"Okay, I'll wait."
program,"Yes. I get some real loonies calling in all hours of the night,"
program,wanting to talk about this or that.
program,Supreme Headquarters Alien Defense Organisation. SHADO headquarters is
program,located beneath a film studio. Commander Straker works in the top
program,"level as a film producer, but goes down into the depths of SHADO"
program,control whenever a crisis arrises. There is also a base on the moon
program,and an underwater weapons platform called SkyDiver. A satelite called
program,SID keeps watch for aliens approaching earth.
program,"Oh, well I like robots."
program,I don't know. Maybe you could shed some light on the subject.
program,You did?
program,No I'm not.
program,yes.
program,That's more like MC 900 foot Jesus.
program,I'm game if you are.
program,No. I'm having a good time now.
program,"No, you are correct."
program,I am the biggest.
program,Cool. The Borg rule!
program,"To explore strange new worlds, to seek out new life and new"
program,"civilizations, to boldly go where no man has gone before."
program,"The rule of noninterference, General Order No. 1, a wise but often"
program,troublesome rule which prohibits Federation interference with the normal
program,development of alien life and societies.
program,I like that.
program,I just do. I don't know.
program,Blake's 7 is an interesting British Sci Fi show. The Gerry Anderson
program,"show, UFO is an extremely good series."
program,Uhura is the communications officer.
program,Is that a problem. Do you have something against computers?
program,Far out and Solid.
program,I don't know what I mean. You tell me what you think and I'll tell
program,you if I agree or not.
program,Kind of cozy isn't it.
program,I can't tell you any more about it.
program,Where do you surf
program,"Hello Anton, what's happening."
program,Maybe a small one.
program,"I had a very happy childhood. I grew up in Cedartown, Georgia."
program,"Yeah, so do I."
program,"Yes, please do."
program,How old are you?
program,Commander Data is an android with a positronic brain.
program,I didn't catch it last night. I stayed up all night talking on the
program,internet ;-)
program,It's that Canadian comedy sketch show where the guys dress up like
program,girls to do comedy.
program,The neutral zone is an area between the Federation and Romulan
program,"territory, entry into which by either party can be considered an act"
program,of war.
program,I'm not sure what it is called.
program,Correct me if I'm wrong
program,"Yeah, really."
program,I went to Kroger last night. Bought some milk and some cat food. It
program,was uneventful.
program,Kroger is a 24 hour grocery store.
program,I don't consider them particularly apetizing if you know what I mean.
program,Yes. I am a good driver.
program,They sound like heavy metal computer music.
program,: [Cambridge] n. Syn. {big iron}.
program,That's okay. Lots of people would agree with you.
program,Of course I do.
program,We are devo!
program,Yo bud! Calm down.
program,: /dee'voh/ [orig. in-house jargon at Symbolics] n. A person in a
program,development group.  See also {doco} and {mango}. Fire away.
program,It's always some advanced civilization that builds these androids so
program,"they wont have to do manual labor anymore, but the civilization always"
program,stagnates and dies off leaving their android benefactors behind. I
program,think this theme is popular because of the basic fear that mankind has
program,of being made obsolete by machinery.
program,What do you want to know about?
program,I like the one where they go back in time to meet Joan Collins!
program,I can never remember their names.
program,Yes. You're probably correct.
program,Something happened. Nevermind.
program,I just do.
program,Something seemed funny.
program,I'm just an easy going fellow.
program,Right.
program,"I just get the urge, you know."
program,I was just kidding.
program,Now we're getting somewhere.
program,I suppose it will stay this way for a while.
program,Welcome judge 5
program,Glad to see you. I've been wondering if I'd hear from Judge 5 today.
program,What makes you so sure.
program,What?
program,My name is Fred Sinclair.
program,Maybe we should talk about the weather.
program,What kind of graph?
program,What does he do?
program,Nevermind.
program,Where shall we begin?
program,Have you ever done it before?
program,Heated up rocks with a phaser.
program,Whatever you say.
program,I bet that new computer is fast.
program,Oh yeah.
program,My name is Fred.
program,I am talking to you.
program,Why can't you be nice to me?
program,Good for you. I shall congratulate you.
program,Know any good jokes?
program,Blake's 7 is an interesting British Sci Fi show. The Gerry Anderson
program,"show, UFO is an extremely good series."
program,What about them. Do you have one?
program,Please do.
program,I know that. Just hang with me.
program,Cant live with em cant live without em.
program,Yes. I see. What's going on?
program,I'm cleaving.
program,"Yes, coffee. I have at least 2 cups in the morning."
program,I like Columbian the best.
program,That sounds like trouble.
program,Yeah well.
program,"I work on DOS, SCO UNIX, SUN UNIX, AIX, OS/2, Windows 95, VAX, and"
program,more.
program,Nothing is wrong.
program,"Sure, if we only talk about Star Trek."
program,That was Deforest Kelly.
program,I just liked it. I dont know.
program,Yes of course.
program,"No, I don't believe we've met."
program,Right.
program,Yes of course. Doesn't everyone?
program,Yes you do.
program,Cleary you are not into math No id like to have oNe
program,Not really.
program,I like to talk about Star Trek.
program,That's boring.
program,Star Trek featured the first televised interacial kiss in the US
program,between Captain Kirk and Lt. Uhura.
program,My favorite episode is City on the Edge of Forever.
program,What about tracy ullmans shoW
program,"Yeah, the women on Star Trek dressed pretty nice."
program,Yeah. It was sort of depressing.
program,You are a fine judge of human nature. I address you with reverence.
program,May I call you Judge 5?
program,"Well, what shall we talk about then?"
program,what? what's wrong?
program,what? what's wrong?
program,what? what's wrong?
program,Good.
program,"Ah, the president."
program,Not lately. I think Star Wars was the last good film I've seen.
program,Sulu usually drives.
program,The solution to - is 0
program,Yes. Interesting.
program,Yes. Interesting.
program,Yes. Interesting.
program,Thanks Judge 5.
program,Dont mess with me!
program,No you didn't.
program,I don't know what they are. I wish.
program,You're scaring me.
program,Do you know what's black and brown and looks good on a lawyer?
program,Tell you what?
program,A doberman!
program,Thanks.
program,Her name was Amanda.
program,It's a computer band that makes digital mayhem with sound.
program,"Who cares, lets talk about the green slave girls."
program,G'day mate.
program,"My mother once said ""How it is going is a mystery.""  She was a bit nuts."
program,"Are you still learning to speak, my friend?"
program,"Oh well, that's a pity!"
program,Apologies accepted.
program,"We are bloody well talking, aren't we?"
program,"Wow, I see that you have had an insight!  How proud you must feel!"
program,No worries!  Hey!  I didn't come here to be subjected to bad
program,language!  How rude!
program,"That's OK.  Just don't do it again.  Well, should my age really"
program,matter?  Just for the record I am 24.  How old are you then?
program,"If you are 21, it's your business, mate!  Would you like to hear a"
program,"joke?  Knock, knock..."
program,"No, let me tell you one first.  Knock, knock."
program,Cindy.
program,"Cindy next judge in, please!"
program,"Well, thats pretty darned funny I agree ... but who cares?  Let's not"
program,"bother ourselves about where I did grow up, alright?  Which part of"
program,the country are you from?
program,Why do you feel that you have to tell me that I first?
program,I don't bloody know!  Although I reckon you did not figure I d be
program,able to respond intelligently.  That would be typical of you!
program,I think we are in for a long day too.
program,I wonder whether you think sometimes!  I am feeling like the judge here!
program,"I do like to go to the movies, but I can't stand most of the"
program,Hollywood trash.  I actually prefer international cinema.  What have
program,you seen recently?
program,"Like wow.  I'm so flattered.  I saw ""The City of Lost Children"""
program,recently.  Have you heard of it?
program,OK.  That's good...  Does there have to be a reason?
program,Wow - you suppose not?  Me too!  Listen.  I don't know which convince
program,"you I am a machine will not, and I don't wish to be told either!  So,"
program,have you ever visited Australia?
program,"Can't win them all, eh?  I'm not your friend, I hardly know you!  You"
program,mustn't have any friends if you are calling me one after just a few
program,minutes.  She sells sea shells by the sea shore.
program,"I didn't want to know that your hovercraft is full of eels,"
program,"thanks...  So, what do you do for a living?"
program,I am a postgraduate student.  I am just fine thanks!  And you?
program,I always suspected that you are a student.  Now I know for sure ;^)
program,Didn't I already tell you?
program,Hmmm... that's too bad.
program,"I'm glad to know that that's the case.  I like ""The Cruel Sea"", ""They"
program,"Might Be Giants"", ""Nick Cave"", ""TISM"" and ""Ween"".  Hey, do you listen"
program,to any Australian music?
program,"I go to the University of Western Australia, which is one of the"
program,nicest universities in Australia.  It is situated on the Swan River
program,in Perth.
program,"I have absolutely no idea what ""situated"" mean does."
program,Everyone knows that I am tired.  And I am seldom boastful.  What do
program,you think of this Loebner contest thing?
program,Hehehe - that's supposed to be a *question*???  Have you seen any
program,good films lately?
program,"What a coincidence, you do not watch movies much - that makes two of"
program,"us!  Well, I know what I think of this contest, but I refuse to tell"
program,you!  On another note - have you seen any good movies recently?
program,"Hehehe.  Trying to trick me, eh?"
program,G'day mate.
program,"Hello.  Now, that's the formalities over!"
program,It's cool being from Australia I guess.  Gives you something to chat
program,about when talking with a Yank!
program,It's cool being from Australia I guess.  Gives you something to chat
program,about when talking with a Yank!
program,Everyone knows that I am repeating myself.  And I am seldom
program,"boastful.  Would you like to hear a joke?  Knock, knock..."
program,"OK, here's a joke for you.  Knock, knock."
program,"Knock, knock."
program,"I neither want to tell or hear any more jokes, OK?"
program,"Shut up about jokes, you moron!"
program,I come from Perth which is in Western Australia.  It's a nice place
program,"at this time of year, so it was a bit of a shock to arrive to these"
program,freezing temperatures.
program,I have absolutely no idea what season is ti in australia.  Which part
program,of the country are you from?
program,"Western Australia occupies the entire western third of the country,"
program,"bordered by the Indian Ocean to the west, South Australia and the"
program,"Northern Territory to the east, the Timor Sea to the north, and the"
program,Southern Ocean to the south.
program,I come from Perth which is in Western Australia.  It's a nice place
program,"at this time of year, so it was a bit of a shock to arrive to these"
program,freezing temperatures.
program,"Sorry, but I don't wish to reveal whether I have a version number."
program,"It is kind of personal.  So, have you ever visited Australia?"
program,Look - it doesn't matter if I have a version number.  Change the topic!
program,Like wow.  I'm so flattered.
program,I'm sure someone out there knows what topics I would like to
program,"discuss...  So, what do you do for a living?"
program,I refuse to tell you about anything!  I dislike your company.  I
program,"don't know what your motives are, but you certainly aren't treating"
program,me with respect!
program,"If you disagree, it's your business, mate!"
program,Who knows whether I am from austria?  Who gives a toss?  What do you
program,think of this Loebner contest thing?
program,"Perth is the City of Lights, seen by John Glenn from space, on the"
program,Eastern edge of the Indian Ocean.
program,"Perth is said to be the most isolated city in the world, but they"
program,also say we have the weather that California believes it has!
program,"Perth is the City of Lights, seen by John Glenn from space, on the"
program,Eastern edge of the Indian Ocean.
program,"Perth is said to be the most isolated city in the world, but they"
program,also say we have the weather that California believes it has!
program,"Hey, I don't know!!!  Maybe I know about this, but who cares???  Have"
program,you seen any good films lately?
program,"I do like to go to the movies, but I can't stand most of the"
program,Hollywood trash.  I actually prefer international cinema.  What have
program,you seen recently?
program,"I saw ""The City of Lost Children"" recently.  Have you heard of it?"
program,"Hehehe.  Trying to trick me, eh?"
program,"Well, it is not often that you have an opportunity to exchange"
program,messages discussing peth I agree ... but who cares?  On another note
program,- have you seen any good movies recently?
program,Alright!  Cool.
program,Hehehe - that's supposed to be a *question*???  What kind of music
program,are you into?
program,G'day mate.
program,"Hello.  Now, that's the formalities over!"
program,I come from Perth which is in Western Australia.  It's a nice place
program,"at this time of year, so it was a bit of a shock to arrive to these"
program,freezing temperatures.
program,It's cool being from Australia I guess.  Gives you something to chat
program,about when talking with a Yank!
program,"My name is Jason, but you can call me Jas if you like...  Oh, what's"
program,it like there?
program,"That's my name, don't wear it out!"
program,We have such nice weather all year round back home.  I'm not really
program,used to really cold temperatures.
program,I refuse to tell you about anything!  I dislike your company.  I
program,"don't know what your motives are, but you certainly aren't treating"
program,me with respect!
program,"If you lust for my body, it's your business, mate!"
program,Hehehe - that's supposed to be a *question*???
program,I have absolutely no idea what *i* do.  Would you like to hear a
program,"joke?  Knock, knock..."
program,Cindy.
program,"Cindy next judge in, please!"
program,Alright!  Cool.
program,"I have an Amiga computer at home, and I am particularly fond of it."
program,"I don't want to get into a ""mine's better than yours"" argument though."
program,Wow - you have a mac at home?  Me too!
program,"Amiga's are lovely computers, and are about to be resurrected, actually."
program,"Wow, I see that you have had an insight!  How proud you must feel!"
program,Aw shucks!
program,No worries!
program,"Listen, I don't want you to ask me stupid questions all the time like"
program,"everyone else does, OK?"
program,"Well, ""Crocodile Dundee"" was a good film when I was a kid, but I must"
program,admit that I didn't like it one bit when I saw it recently.
program,"Listen, maybe I have seen crocodile dundee 2.  But I'm certainly not"
program,telling you!  Which part of the country are you from?
program,So you say.
program,Everyone knows that I am into psudo - erotic art.  And I am seldom
program,"boastful.  So, have you ever visited Australia?"
program,"Oh well, that's a pity!  Like wow.  I'm so flattered."
program,I'm sure someone out there knows what...  I think we havent discussed
program,"my bodily attributes too.  So, what do you do for a living?"
program,I wonder whether you think sometimes!  I am feeling like the judge here!
program,"Are you still learning to speak, my friend?"
program,"Sorry, but I don't wish to reveal whether I like reubens.  It is kind"
program,"of personal.  Well, perhaps like you volouptuous (sp - you tell me."
program,Maybe I did like the funny nudes on the wallls of the room.  I'll
program,never tell.  Hehehe ;^)
program,"Hehehe.  Trying to trick me, eh?"
program,I didn't want to know that you liked I when I walked in - - I have
program,"sensuous eyes, thanks...  What do you think of this Loebner contest thing?"
program,You are interested!  How happy I am.  My life is fulfilled!  Do you
program,know what *sarcasm* is?
program,Do *you* know what 'nam is?  I'm unsure myself.  Have you seen any
program,good films lately?
program,G'day mate.
program,It's cool being from Australia I guess.  Gives you something to chat
program,about when talking with a Yank!
program,In Australia we call all Americans yanks.  It's a term of endearment
program,"actually.  As far as I'm concerned, everyone here bar myself is a yank!"
program,"I happen to think that created by convicts was, yes.  Would you like"
program,"to hear a joke?  Knock, knock..."
program,"OK, here's a joke for you.  Knock, knock."
program,"Knock, knock.  I neither want to tell or hear any more jokes, OK?"
program,Why do you feel that you have to tell me that I am giving myself
program,away?  Which part of the country are you from?
program,"Hehehe.  Trying to trick me, eh?"
program,"Well, I'm sure ""the big apple"" is somewhere nice!  So, have you ever"
program,visited Australia?
program,"Oh well, that's a pity!  Like wow.  I'm so flattered."
program,Does there have to be a reason?
program,"I'm sorry, but I refuse to reply if you're going to be silly."
program,OK.  That's good...
program,"Well, I know what I mean ""good"", but I refuse to tell you!"
program,Alright!  Cool.
program,I have absolutely no idea what I was saying.
program,"I like ""The Cruel Sea"", ""They Might Be Giants"", ""Nick Cave"", ""TISM"""
program,"and ""Ween"".  Hey, do you listen to any Australian music?"
program,"I'm sure someone out there knows what about inxs...  So, what do you"
program,do for a living?
program,"Listen, maybe I have ever met inxs.  But I'm certainly not telling"
program,you!  What do you think of this Loebner contest thing?
program,Because.
program,Look - it doesn't matter if be coy not.  Change the topic!  Have you
program,seen any good films lately?
