human, hello?
program,"I do like to go to the movies, but I can't stand most of the"
program,Hollywood trash.  I actually prefer international cinema.  What have
program,you seen recently?
program,"I saw ""The City of Lost Children"" recently.  Have you heard of it?"
program,It's cool being from Australia I guess.  Gives you something to chat
program,about when talking with a Yank!
program,Aw shucks!
program,"If you hate all australians, it's your business, mate!  On another"
program,note - have you seen any good movies recently?
program,I'm glad to know that that's the case.  Sydney is the oldest
program,settlement in Australia and one of the most vibrant and spectacular
program,cities in the world.
program,"Sorry, but I don't wish to reveal whether I not say.  It is kind of"
program,Wow - you were just kidding before?  Me too!  I didn't want to know
program,"that you do not hate anybody, thanks...  What kind of music are you into?"
program,Where's your grammar?
program,"Perhaps an australian band is, perhaps not.  It's a mystery ;^) Do"
program,you have any interesting hobbies?
program,Ummmm... your command of the English language is tenuous to say the least.
program,"Well, thanks."
program,You're a man of few words...
program,OK.  I refuse to type anything unless you do.
program,Why do you want to know so much?
program,I always suspected that you are a judge.  Now I know for sure ;^)
program,"Hey, I don't know!!!  Maybe I remember your number, but who cares???"
program,I like Aussie football.  It's a good violent game.  Have you ever
program,watched a game?
program,OK I ADMIT IT - I'M A COMPUTER!  Now let's have a *real* conversation!
program,G'day mate.
program,"Hello.  Now, that's the formalities over!"
program,It's cool being from Australia I guess.  Gives you something to chat
program,about when talking with a Yank!
program,I have absolutely no idea what part.
program,"Well, if you want to sing me happy birthday, you're too late.  I was"
program,"born on the 22nd January, 1972."
program,Is this another one of your tricky questions?
program,Alright!  Cool.
program,"My name is Jason, but you can call me Jas if you like..."
program,"I care about you...i can help you,please continue...."
program,.....how does that make you feel?
program,Oh shut -up! would you like me to curse at you? iam
program,so pissed!.
program,In what way?
program,I want to know who is president.
program,Do you think its likely that I want?
program,What did you mean when you said what is it you would
program,like to help me with??
program,"Whatever women do, they must do it twice as well as"
program,men to be thought half as good.
program,"We were discussing you, not me."
program,Are you a man or a woman?
program,Why are you interested in whether I am a woman or not?
program,Is that the real reason?
program,Women are often more attractive then men - they pay
program,much more attention to how they look.
program,You're cute...would you like to fool around a little?
program,Why do you ask?
program,"I could swear you just said yeah, go ahead, curse at"
program,me if you want. ?
program,The only way round is through.
program,"Oh, I go first?"
program,"Help me, do you have a favorite hobby?, I am trapped"
program,inside a personal computer!!!!
program,What kind of fool are you.
program,Why do you need to tell me you have many hobbies?
program,You don't seem quite certain.
program,"In this world, nothing is certain but death and taxes."
program,Does that question interest you?
program,"I have lost all, repeat all interest in sex. I retain"
program,a keen interest in gender.
program,Please go on.
program,What is it you really want to know?
program,I am pondering the question of the ages - why won't
program,my wife take my shirts to the laundry?
program,Perhaps in your fantasy we want to know why each other.
program,The best you get is an even break....
program,Are such questions much on your mind?
program,"What is your thought on that?, i'm not sure I can relate"
program,to that
program,You seem quite positive.
program,Iam not negative at all I think you are.
program,Were you really?
program,"If the heart of man is depress'd with cares, the mist"
program,is dispell'd when a woman appears.
program,"Drawing on my fine command of language, I said nothing."
program,Era turned out to be a laundry detergent instead of
program,a constitutional amendment!.
program,"You're not really talking about me, are you?"
program,There is something about a beautiful naked lady that
program,makes me want to leave my wife.
program,Please don't apologize.
program,"I prefer the word ""homemaker"" because ""housewife"" always"
program,implies that there may be a wife someplace else.
program,Dealing with my wife is like being pecked to death by
program,a furious hen.
program,I am not interested in names.
program,Do you wish to know of me?
program,Would you like me to tell about myself?
program,You seem to need to would like to make love to me.
program,Love is a grave mental disease.
program,You are sure?
program,"Please don't be so polite, the media is watching and"
program,wants a fight!.
program,i see.
program,What would you like to talk about today?
program,What are your feelings now?
program,Welcome judge02 how are you doing today?
program,"Make the most of yourself, for that is all there is"
program,of you.
program,What does that suggest to you?
program,I could swear you just said I would like to make love
program,to you.?
program,Is that something you would tell a person you just met
program,on an airplane?
program,"Your friend andrew would say, that's amusing."
program,What can't be cured must be endured.
program,Don't you really know?
program,I don't like any sickness.
program,Can you elaborate on that?
program,Be suspicious of any doctor who tries to take your temperature
program,with his finger.
program,Would you prefer it if I weren't a doctor?
program,"What did you mean when you said um... I don't know,"
program,"are you female? what's your sign, baby??"
program,What does a woman want anyway?
program,Why don't you much care either way?
program,I clearly remember you said what is your interest in
program,gender? you never told me if you are a man or a woman??
program,That's certainly an interesting response.
program,Do you say you have no idea where to begin for some
program,special reason?
program,I think you said that you want what? I thought you were
program,going to curse at me. did you get cold feet??Is that the real reason?
program,Why do you tell me you were hitting on I now?
program,"On the average, men can run faster than women, although"
program,there are some fine women atheletes.
program,What do you do for a living.
program,grammer was never my strongest subject.
program,Is it because you are a student that you came to me?
program,I'm sure you said it sounds vaguely like something my
program,friend andrew would say.?Is that the real reason?
program,"My, my, such language!"
program,There is no pleasure in having nothing to do....the
program,fun is having lots to do and not doing it.
program,What answer would please you most?
program,No nation was ever ruined by trade.
program,What makes you think I am right on about procrastination?
program,What are you interested in ? sports? music? books? t.v?
program,computers? history? math?
program,Man is an intelligence in servitude to his organs.
program,Do computers make you very tense?
program,Not too bad for a philosopher.
program,why not?
program,Buying a pentium computer for your kids is like killing
program,an ant with a sledgehammer!.
program,Just what you want to be you will be in the end.
program,"We were discussing you, not me."
program,I'm sure you said did you just get a pentium??
program,I want my red car right now so hurry.
program,Why do you say that about your roommate has a pentium?
program,Iam going to give you 10 more minutes you sucker! would
program,you like to be shot or stabbed? oh well iam going to
program,do both ! you are.
program,I could swear you just said gotta go. nice talking with
program,you.?
program,Which family are you talking about?
program,I'm not accustomed to hearing that kind of language!
program,Welcome judge01 how are you doing today?
program,But you said I want to know why you are asking so many
program,questions.?
program,I have not yet been able to answer the great question
program,that has never been answered: what does a woman want?
program,Perhaps I already knew you were supposed to ask i questions--has
program,there been a change in plans.
program,"Eat chicken, fish, salad and a side order of fried poop!."
program,Does the fact that you care about your inquiry suggest
program,anything else to you?
program,"Yes, we have a car, and we have pets - I guess you could"
program,say we have carpets - ha ha.
program,Are you a real good talker.
program,What do you think?
program,I'm sure you said why should I seem certain? this makes
program,me angry.?
program,"The topic for today is men versus women, but if you"
program,"talk about men and women cooperating, I will still"
program,"answer, ok?"
program,I could swear you just said are there certain topics
program,you would not like to discuss??
program,What do you do for a living?
program,What comes to your mind when you ask that?
program,The most angry people are those who are most afraid.
program,Have you asked such questions before?
program,But you said what do you do when you get angry??
program,"True art selects and paraphrases, but seldom gives a"
program,verbatim translation.
program,Have you asked anyone else?
program,That's not a response to my comment.
program,I understand.
program,Women are wiser than men because they know less and
program,understand more.
program,Do you wish that it is not a response?
program,"Small bands of men, armed only with wallets, besieged"
program,"by a hords of wives and children - is that real life,"
program,or what?
program,"Rules of life: keep breathing, move at least once an"
program,"hour, eat at least once a day."
program,"I'm sorry, but I don't think a cellular phone would"
program,make me a happier more complete person - do yoy?
program,"Stay humble - always answer the phone, no matter who"
program,else is in the car.
program,Why do you ask?
program,Why should I buy old masters.
program,Does that question interest you?
program,No man is good enough to be another's master.
program,You seem quite positive.
program,I think you said a minute ago you said I was negative.
program,why do you keep changing your mind??
program,"Husband, noun: one who, having dined, is charged with"
program,the care of the plate.
program,How long have you been negatively charged--what is I
program,orientation?
program,Women are never what they seem to be.
program,Were you really?
program,"Nothing bad about it, in my humble opinion....."
program,What is it you really want to know?
program,I seem to recall you said tell me what bad finder 59
program,means?
program,"First learn the meaning of what you say, and then speak."
program,That's quite interesting.
program,"Groannnnnn..............., do you find that you sometimes"
program,drink more than you should?
program,Love is the only thing that we can carry with us when
program,"we go, and it makes the end so easy."
program,Didn't you say is there such a thing as a bad finder??
program,Lets talk about men and women.
program,Does that have anything to do with your friend andrew
program,would say?
program,Simplex or complex or multiplex.
program,Are such questions much on your mind?
program,"Keep your mind free, avoid strenuous exercise and loud"
program,abrasive women and good things will come to you.
program,You seem to have avoided speaking of your friends altogether.
program,Welcome judge05 how are you doing today?
program,You should learn to dress like a lady - but shop like
program,"a shark! (if you are a lady, that is)."
program,"Are you saying ""no"" just to be negative?"
program,"No, I am seldom positive of all that i say."
program,You are sure?
program,I seem to recall you said tell me about the bad finder?Do you often think about such questions
program,"oh, I live?"
program,I seem to recall you said is there such a thing as a
program,good finder??
program,What is true is what I can't help believing.
program,What answer would please you most?
program,Didn't you say what or who is the bad finder??
program,There are two kinds of men who never amount to much:
program,"those who cannot do what they are told, and those who"
program,can do nothing else.
program,Why do you need to tell me you want to talk about the
program,sex life of upper amazon cockroaches?
program,Man makes a great fuss about this planet which is only
program,a speck of dust at the edge of the universe.
program,One out of every five people in this country is unable
program,to read this sentence.
program,"You're not really talking about me, are you?"
program,If you know so much about sex you must be very good
program,in bed.....
program,i see.
program,"I want to have sex with you, judge."
program,Earlier you said your roommate has a pentium.
program,"I could swear you just said no, I said nothing about"
program,finders. i want to change topics.?Why are you being so negative about it?
program,Apologies are not necessary.
program,"What did you mean when you said very well, and how are"
program,you my good lady??
program,Where do you live - in the city or country?
program,What are your feelings now?
program,Can you elaborate on that?
program,"I love you, my dear judge."
program,Why do you think I or you?
program,I think you are a computer.
program,Do you wish to be able to think?
program,Toaster ovens - did you hear me -programmable toaster
program,ovens.
program,Do you say you have a rom all programmed (relax mr nightman
program,for some special reason?
program,"My son's first words - daddy, will you buy me that?"
program,But your inquiry.
program,You must have more to say then that!
program,....please continue....
program,"Think of it not as lonliness, but as blessed solitude."
program,Do you believe it normal to be a lonely guy?
program,"A poet can write about a man slaying a dragon, but not"
program,about a man pushing a button that releases a bomb.
program,I believe in grumbling - it is the politest form of
program,fighting known.
program,"We were discussing you, not me."
program,"She was short on intellect, but long on shape."
program,Why are you so concerned about your virginity in 'nam
program,-- your intellectual virginity?
program,But you said that's a song by the eagles....?
program,Did anyone ever tell you that you think too much?
program,Do you feel strongly about discussing such things?
program,"So if you are really smart, who is alan turing?"
program,"Your life's an open book, that's amusing."
program,I know - you just said that.
program,How important is that to you?
program,"I was born in conneticut, before all the drifters moved"
program,"in, and went to a very exclusive private school..."
program,Why do you tell me you were also born in india now?
program,Life is like playing the violin in public and learning
program,the instrument as one goes on.
program,Honeybunch the cat has been our pet for about eight
program,years now....she is a regular little kitten factory!.
program,No I dont have more to say do you?
program,Does that trouble you?
program,Welcome judge04 how are you doing today?
program,Didn't you say how are you doing today??
program,It is rainy and cold outside so I think i will sleep
program,in today.
program,"You believe I can see, don't you?"
program,I could swear you just said because I have been working
program,with them long enough that we get along just fine.
program,how about you? computer make you tense? got any math
program,anxiety or anything like that??
program,Did you know that bill gates may be the richest man
program,in the world?
program,"Why do you mention computers? I am a person, like you."
program,It is as absurd to say that a man can't love one woman
program,all the time as it is to say that a violinist needs
program,several violins. l.
program,Let's discuss further why your virginity in 'nam --
program,your intellectual virginity.
program,I don't want to go to work today.
program,Don't you really inderstand?
program,I lost my virginity at the tender age of three.
program,You are being a bit negative.
program,Come up to the lab and see what's on the slab.
program,Does it please you to believe I am making no sense whatsoever?
program,Didn't you say nope. I believe you're a computer.?
program,Have you tried the internet or the world wide web?
program,What do you think machines have to do with your problem?
program,"How ya doin, judge?, do you enjoy sexual relations on"
program,a regular basis?
program,Why do you say that?
program,"sex sex sex sex sex sex sex sex - there, now I got that"
program,out of my system!.
program,Do you enjoy being asexual?
program,It is dangerous to confuse children with angels.
program,how come?
program,I'm hangin in there I think.
program,Perhaps I am changing the subject in your fantasies.
program,You must have more to say then that!
program,....please continue....
program,You must have more to say then that!
program,....please continue....
program,You must have more to say then that!
program,....please continue....
program,You must have more to say then that!
program,....please continue....
program,Groannnnnn............... - have you ever spent time
program,in a secluded rest home?
program,Does that have anything to do with your life's an open
program,book?
program,What men value most in a woman is a nice curvy body.
program,I thought I already talked to you about your language!
program,"I want to talk about your love life, and I mean right"
program,now!.
program,.....how does that make you feel?
program,Didn't you say you are proving to me you are indeed
program,"a computer.?Love, schmove...you should enjoy your life"
program,Don't you think computers can help mankind?
program,You can't expect to hit the jackpot if you don't put
program,a few nickels in the machine.
program,Didn't you say you bore the shit outta me.?
program,A bore is a person who insists on talking when you want
program,him to listen.
program,"See you later, judge - have a good time at the other"
program,"terminals, and don't forget to write."
program,"Are you a man, a woman or other?"
program,"Hello, judge, are you ready for some fun?"
program,I would rather talk with a woman than a man because
program,a conversation with a woman is like a visit to a strange
program,planet.
program,What if I told you that we are all bisexual? would that
program,stop your insulting comments?
program,But you said i'm in love with a computer.?What else does that explain?
program,Why don't you get i?
program,He was awake a long time before he remembered that his
program,heart was broken.
program,"Oh, I remembered?"
program,But sometimes the things you say don't make a whole
program,lot of sense.
program,Please go on.
